{
  "schemaVersion": 1,
  "task": {
    "id": "task-localize-482-520",
    "projectId": "project-stellar-legend",
    "scope": {
      "projectId": "project-stellar-legend",
      "batchId": "batch-story-07",
      "segmentIds": ["482", "483", "484", "485", "486", "487", "488", "489", "490", "491", "492", "493", "494", "495", "496", "497", "498", "499", "500", "501", "502", "503", "504", "505", "506", "507", "508", "509", "510", "511", "512", "513", "514", "515", "516", "517", "518", "519", "520"],
      "sourceLocale": "zh-CN",
      "targetLocale": "en-US"
    },
    "title": "本地化 482–520 段",
    "intent": "审校星辰传说中文剧情 482–520 段，保持角色语气与术语一致。",
    "kind": "translation",
    "status": "active",
    "createdAt": "2026-07-10T09:40:00.000Z",
    "updatedAt": "2026-07-10T09:45:30.000Z"
  },
  "activeRunId": "run-team-001",
  "eventCursor": "cursor-106",
  "projectedAt": "2026-07-10T09:45:30.000Z",
  "runs": [
    {
      "id": "run-team-001",
      "taskId": "task-localize-482-520",
      "mode": "team",
      "status": "active",
      "rootAgentThreadId": "thread-main",
      "planHash": "plan-sha256-fixture",
      "estimatedCalls": 4,
      "modelRoutes": {
        "producer": "deepseek/deepseek-v4-flash",
        "editor": "deepseek/deepseek-v4-flash"
      },
      "startedAt": "2026-07-10T09:41:00.000Z",
      "updatedAt": "2026-07-10T09:45:30.000Z",
      "completedAt": null,
      "stopAvailable": true,
      "resumeAvailable": false,
      "usage": {
        "inputTokens": 4120,
        "outputTokens": 780,
        "cacheReadTokens": 1200,
        "cacheWriteTokens": 0,
        "totalTokens": 6100,
        "costUSD": 0.0184,
        "modelCalls": 2
      },
      "resourceManifest": {
        "profile": "main",
        "packages": [
          {
            "name": "@eko24ive/pi-ask",
            "source": "npm:@eko24ive/pi-ask@1.1.0",
            "version": "1.1.0",
            "integrity": "sha256-patched-ask-fixture"
          }
        ],
        "activeToolNames": [
          "ask_user",
          "tm_lookup"
        ],
        "requestShapeHash": "request-shape-fixture",
        "systemPromptHash": "system-prompt-fixture",
        "toolSurfaceHash": "tool-surface-fixture",
        "resourceIndexHash": "resource-index-fixture",
        "requestShape": {
          "schemaVersion": 2,
          "systemPromptChars": 1840,
          "activeToolCount": 2,
          "resourceCount": 3
        }
      }
    }
  ],
  "agentThreads": [
    {
      "id": "thread-main",
      "taskId": "task-localize-482-520",
      "runId": "run-team-001",
      "parentThreadId": null,
      "identity": {
        "kind": "main",
        "roleId": "linguist-agent",
        "displayName": "Linguist Agent",
        "roleLabel": "主 Agent",
        "disclosureLabel": "Agent"
      },
      "status": "active",
      "canReceiveUserMessage": true,
      "handoffSummary": null,
      "latestActivityId": "activity-main-handoff",
      "childThreadIds": [
        "thread-editor"
      ],
      "createdAt": "2026-07-10T09:41:00.000Z",
      "updatedAt": "2026-07-10T09:42:00.000Z"
    },
    {
      "id": "thread-editor",
      "taskId": "task-localize-482-520",
      "runId": "run-team-001",
      "parentThreadId": "thread-main",
      "identity": {
        "kind": "specialist",
        "roleId": "editor",
        "displayName": "Editor",
        "roleLabel": "语言与一致性审校",
        "disclosureLabel": "Agent"
      },
      "status": "active",
      "canReceiveUserMessage": true,
      "handoffSummary": "审校 Translator 候选，核对角色语气、TM 与术语一致性。",
      "latestActivityId": "activity-editor-artifact",
      "childThreadIds": [],
      "createdAt": "2026-07-10T09:42:00.000Z",
      "updatedAt": "2026-07-10T09:45:30.000Z"
    }
  ],
  "activities": [
    {
      "id": "activity-main-ack",
      "taskId": "task-localize-482-520",
      "runId": "run-team-001",
      "agentThreadId": "thread-main",
      "seq": 1,
      "type": "acknowledgement",
      "status": "done",
      "actor": {
        "kind": "agent",
        "id": "linguist-agent",
        "displayName": "Linguist Agent",
        "agentThreadId": "thread-main"
      },
      "title": "已接收任务",
      "body": "我会先核对项目约束与证据，再把候选交给 Editor 审校。",
      "tool": null,
      "refs": {
        "artifactIds": [],
        "evidenceRefs": [],
        "decisionIds": []
      },
      "createdAt": "2026-07-10T09:41:01.000Z",
      "updatedAt": "2026-07-10T09:41:01.000Z"
    },
    {
      "id": "activity-main-handoff",
      "taskId": "task-localize-482-520",
      "runId": "run-team-001",
      "agentThreadId": "thread-main",
      "seq": 2,
      "type": "handoff",
      "status": "done",
      "actor": {
        "kind": "agent",
        "id": "linguist-agent",
        "displayName": "Linguist Agent",
        "agentThreadId": "thread-main"
      },
      "title": "交给 Editor 审校",
      "body": "重点核对段 487 的角色语气、TM 与术语证据。",
      "tool": null,
      "refs": {
        "artifactIds": [],
        "evidenceRefs": [
          "tm:TM_4521",
          "term:moon",
          "term:secret"
        ],
        "decisionIds": []
      },
      "createdAt": "2026-07-10T09:42:00.000Z",
      "updatedAt": "2026-07-10T09:42:00.000Z"
    },
    {
      "id": "activity-editor-ack",
      "taskId": "task-localize-482-520",
      "runId": "run-team-001",
      "agentThreadId": "thread-editor",
      "seq": 1,
      "type": "acknowledgement",
      "status": "done",
      "actor": {
        "kind": "agent",
        "id": "editor",
        "displayName": "Editor",
        "agentThreadId": "thread-editor"
      },
      "title": "已接收审校任务",
      "body": "我会核对候选、证据与机械约束，然后提交可审阅产物。",
      "tool": null,
      "refs": {
        "artifactIds": [],
        "evidenceRefs": [],
        "decisionIds": []
      },
      "createdAt": "2026-07-10T09:42:02.000Z",
      "updatedAt": "2026-07-10T09:42:02.000Z"
    },
    {
      "id": "activity-editor-evidence",
      "taskId": "task-localize-482-520",
      "runId": "run-team-001",
      "agentThreadId": "thread-editor",
      "seq": 2,
      "type": "evidence_read",
      "status": "done",
      "actor": {
        "kind": "agent",
        "id": "editor",
        "displayName": "Editor",
        "agentThreadId": "thread-editor"
      },
      "title": "读取 TM/TB 与角色语气证据",
      "body": "TM_4521 为 92% 模糊匹配；moon 与 secret 均有已确认术语。",
      "tool": {
        "name": "evidence_pack",
        "effect": "read",
        "target": "segment:487",
        "outcome": "3 条可引用证据"
      },
      "refs": {
        "artifactIds": [],
        "evidenceRefs": [
          "tm:TM_4521",
          "term:moon",
          "term:secret"
        ],
        "decisionIds": []
      },
      "createdAt": "2026-07-10T09:42:10.000Z",
      "updatedAt": "2026-07-10T09:42:12.000Z"
    },
    {
      "id": "activity-editor-check",
      "taskId": "task-localize-482-520",
      "runId": "run-team-001",
      "agentThreadId": "thread-editor",
      "seq": 3,
      "type": "tool_action",
      "status": "done",
      "actor": {
        "kind": "agent",
        "id": "editor",
        "displayName": "Editor",
        "agentThreadId": "thread-editor"
      },
      "title": "检查标签、占位符、数字与换行",
      "body": "机械约束全部通过。",
      "tool": {
        "name": "quality_audit",
        "effect": "read",
        "target": "segment:487",
        "outcome": "delivery-safe"
      },
      "refs": {
        "artifactIds": [],
        "evidenceRefs": [
          "qa:segment-487"
        ],
        "decisionIds": []
      },
      "createdAt": "2026-07-10T09:44:00.000Z",
      "updatedAt": "2026-07-10T09:44:04.000Z"
    },
    {
      "id": "activity-editor-artifact",
      "taskId": "task-localize-482-520",
      "runId": "run-team-001",
      "agentThreadId": "thread-editor",
      "seq": 4,
      "type": "artifact_update",
      "status": "done",
      "actor": {
        "kind": "agent",
        "id": "editor",
        "displayName": "Editor",
        "agentThreadId": "thread-editor"
      },
      "title": "提交段 487 候选译文",
      "body": "已生成可审阅候选，等待接受或请求修改。",
      "tool": null,
      "refs": {
        "artifactIds": [
          "artifact-segment-487-v1"
        ],
        "evidenceRefs": [
          "tm:TM_4521",
          "term:moon",
          "term:secret",
          "qa:segment-487"
        ],
        "decisionIds": [
          "decision-review-487"
        ]
      },
      "createdAt": "2026-07-10T09:45:30.000Z",
      "updatedAt": "2026-07-10T09:45:30.000Z"
    }
  ],
  "artifacts": [
    {
      "id": "artifact-segment-487-v1",
      "taskId": "task-localize-482-520",
      "runId": "run-team-001",
      "type": "segment_proposal",
      "status": "reviewable",
      "title": "候选译文 · 段 487",
      "summary": "Editor 建议将 secrets 改为单数 secret，以符合上下文与术语证据。",
      "scope": {
        "projectId": "project-stellar-legend",
        "batchId": "batch-story-07",
        "segmentIds": [
          "487"
        ],
        "sourceLocale": "zh-CN",
        "targetLocale": "en-US"
      },
      "version": 1,
      "provenance": {
        "agentThreadId": "thread-editor",
        "activityId": "activity-editor-artifact",
        "evidenceRefs": [
          "tm:TM_4521",
          "term:moon",
          "term:secret",
          "qa:segment-487"
        ],
        "parentArtifactIds": []
      },
      "availableDecisions": [
        "approve",
        "reject",
        "request_change",
        "apply"
      ],
      "content": {
        "segmentId": "487",
        "source": "今晚，月亮会替我保守秘密。",
        "currentTarget": "Tonight, the moon will keep my secrets.",
        "candidateTarget": "Tonight, the moon will keep my secret.",
        "tags": [],
        "placeholders": [],
        "qaChecks": [
          {
            "id": "placeholders",
            "label": "占位符",
            "status": "passed"
          },
          {
            "id": "terminology",
            "label": "术语与 TM",
            "status": "passed"
          }
        ]
      },